{
  "$schema": "../schemas/tool.schema.json",
  "name": "allineate",
  "version": "1.0.0",
  "description": "Skull strip NIfTI volumes using allineate registration with MNI152 template",
  "inputs": {
    "nifti_path": {
      "type": "volume",
      "description": "Path to a single input NIfTI volume",
      "optional": true
    },
    "nifti_paths": {
      "type": "volume[]",
      "description": "Array of input NIfTI volume paths",
      "optional": true
    },
    "output_dir": {
      "type": "string",
      "description": "Output directory for skull-stripped files",
      "optional": true
    },
    "cost": {
      "type": "string",
      "description": "Cost function for registration",
      "optional": true,
      "default": "ls",
      "enum": ["ls", "hel", "mi", "nmi", "cr", "ncc"]
    }
  },
  "outputs": {
    "output_paths": {
      "type": "volume[]",
      "description": "Paths to skull-stripped NIfTI volumes"
    },
    "output_dir": {
      "type": "string",
      "description": "Directory containing output files"
    }
  },
  "block": {
    "id": "skull-strip-allineate",
    "label": "Skull-strip (MNI152)",
    "description": "Strip skull by registering to the MNI152 template and applying its brain mask",
    "category": "Processing",
    "icon": "TransformIcon",
    "defaults": {
      "cost": "ls"
    },
    "exposedFields": ["nifti_paths", "output_dir"],
    "hiddenFields": ["cost", "nifti_path"]
  },
  "exec": {
    "binary": {
      "name": "allineate",
      "paths": {
        "darwin": "native-binaries/darwin/allineate",
        "linux": "native-binaries/linux/allineate",
        "win32": "native-binaries/win32/allineate.exe"
      },
      "packagedPaths": {
        "darwin": "native/allineate-macos",
        "linux": "native/allineate-linux",
        "win32": "native/allineate.exe"
      }
    },
    "outputDir": {
      "input": "output_dir",
      "tempPrefix": "wf-allineate-"
    },
    "resources": {
      "templatePath": { "standardImage": "mni152_head" },
      "maskPath": { "standardImage": "mniMask" }
    },
    "forEach": "nifti_paths",
    "iterationVar": "nifti_path",
    "parallel": true,
    "outputFile": {
      "template": "{{inputBasename}}_brain.nii.gz",
      "stripExtensions": [".nii.gz", ".nii"]
    },
    "args": [
      { "value": "{{resources.templatePath}}" },
      { "input": "nifti_path" },
      { "flag": "-cost", "input": "cost", "default": "ls" },
      { "flag": "-skullstrip", "value": "{{resources.maskPath}}" },
      { "value": "{{outputFile}}" }
    ],
    "exitCodes": [0],
    "outputs": {
      "output_paths": { "collect": "outputFiles" },
      "output_dir": { "value": "{{outputDir}}" }
    }
  }
}
